User Information,backstory
"{""name"":""Shannon Rios"",""age"":42,""native_language"":""Indonesian"",""target_language"":""French"",""occupation"":""Therapist, horticultural"",""learning_duration"":""1 months"",""country_of_origin"":""Austria"",""study_frequency"":""7 days per week, 67 minutes per day"",""interests"":[""Photography"",""Meditation"",""Chess""],""preferred_resources"":[""Language exchange websites"",""Grammar books"",""Podcasts""],""current_level"":""B1""}","Shannon Rios, a warm-hearted therapist with a passion for horticulture, was born in the picturesque landscapes of Austria. Growing up, she was surrounded by lush gardens where her family, who immigrated from Indonesia, cultivated unique plants that spoke to her native language. Her parents often shared stories of their homeland, weaving a rich tapestry of Indonesian culture into her upbringing. This connection to her native language created a deep-rooted appreciation for the transformative power of communication.

At age 42, after years of helping others heal through therapy, Shannon decided to embark on a new journey: learning French. The motivation stemmed from her desire to enhance her career. She believed that being bilingual would not only broaden her professional reach but also allow her to connect with a diverse clientele in her therapeutic practice. Additionally, the melodic tones of the French language captured her heart, prompting her to start this language-learning endeavor just a month ago.

Within the first month of her learning journey, Shannon has advanced to a solid B1 level. Her commitment is impressive; she dedicates almost an hour and ten minutes every day, immersing herself in the study of French, treating it with the same devotion she gives her clients. Seven days a week, she dives into grammar books, explores language exchange websites, and listens to engaging podcasts. These resources have made French more relatable, bridging the gap between theory and practice.

Along the way, Shannon has faced challenges, notably the complex grammar rules and pronunciation nuances. Instead of becoming discouraged, she harnessed her mediation skills to embrace mindfulness in her learning process, treating mistakes as valuable lessons rather than setbacks. 

Her interests in photography and chess have subtly influenced her studies, as she often snaps photos of nature that spark French vocabulary related to the flora she loves, while chess's strategic planning mirrors her approach to mastering the language.

Looking to the future, Shannon dreams of becoming fluent in French and possibly incorporating it into her therapeutic practice. She envisions facilitating workshops in French on mindfulness and horticulture, blending her worlds in a harmonious exchange. The journey is just beginning for Shannon, and with her heart set on growth, she continues to bloom alongside the words she learns."
"{""name"":""Ralph Christensen"",""age"":41,""native_language"":""Luxembourgish"",""target_language"":""French"",""occupation"":""Geoscientist"",""learning_duration"":""5 months"",""country_of_origin"":""Afghanistan"",""study_frequency"":""7 days per week, 53 minutes per day"",""interests"":[""Cooking"",""Woodworking"",""Hiking""],""preferred_resources"":[""Online courses"",""Podcasts"",""Language exchange websites""],""current_level"":""B1""}","Ralph Christensen, a 41-year-old geoscientist, was born into a vibrant and culturally diverse family in Afghanistan. Growing up, the sounds of Luxembourgish resonated throughout his household, spoken fluently by his parents who had immigrated to Afghanistan from Luxembourg. This unique blend of cultures instilled in Ralph a profound appreciation for languages and the stories they convey. However, the political landscape of Afghanistan overshadowed his childhood, making it challenging to nurture his love for different tongues.

Having settled in Luxembourg years later due to unforeseen circumstances, Ralph yearned to connect more deeply with the local community and utilize his professional expertise. His role as a geoscientist often placed him in collaboration with French-speaking colleagues from across Europe. This motivated him to learn French, not just as a linguistic endeavor but as a means to foster connections and enhance teamwork in his field. 

For five months now, Ralph has dedicated himself to mastering French, progressing to a B1 level through consistent, daily practice. He has embraced a study routine that typically sees him engaging with the language for 53 minutes every day, a discipline he incorporates seamlessly into his busy life. Online courses, captivating podcasts, and language exchange platforms have become his primary resources, allowing him to immerse himself in the language despite his demanding profession. 

Challenges have not been in short supply; Ralph faced moments of self-doubt, especially during the early stages when verb conjugation felt more like a puzzle than a language feature. To overcome this, he adopted a strategy of combining his interests in cooking and baking. He began following French recipes, an imaginative approach that turned language learning into a practical and enjoyable experience. Each dish became a lesson, enriching his vocabulary while tantalizing his taste buds.

Ralph’s passion for woodworking, too, has played a role in his language journey. He has sought out French woodworking forums, allowing him to mingle with fellow enthusiasts, practice his grammar, and exchange project ideas. As his fluency grows, so does his aspiration to travel to French-speaking regions—a future where he can explore the landscapes he studies and converse with local artisans.

Ultimately, Ralph envisions a world where he effortlessly converses in French, emboldened by language and culture, solidifying his role as both a scientist and a global citizen."
